{"case_id":"case-c6c987d2ef079acf3013592f754d1cbce8fcedf85185cef9bc40e3ff7fb8698c","configurations":[{"configuration_id":0,"permutation":[1,0,3,2]},{"configuration_id":1,"permutation":[2,3,0,1]}],"dependency_mode":"global_step_barrier","execution_mode":"full_packet","flow_groups":[{"completion_token_id":1,"configuration_id":0,"depends_on_token_ids":[0],"flow_group_id":0,"flow_ids":[0],"plane_id":0,"program_epoch_id":0,"step_id":0},{"completion_token_id":2,"configuration_id":0,"depends_on_token_ids":[0],"flow_group_id":1,"flow_ids":[1],"plane_id":1,"program_epoch_id":0,"step_id":0},{"completion_token_id":4,"configuration_id":1,"depends_on_token_ids":[3],"flow_group_id":2,"flow_ids":[2],"plane_id":0,"program_epoch_id":1,"step_id":1},{"completion_token_id":5,"configuration_id":0,"depends_on_token_ids":[3],"flow_group_id":3,"flow_ids":[3],"plane_id":1,"program_epoch_id":1,"step_id":1}],"flows":[{"dst_rank":1,"flow_group_id":0,"flow_id":0,"payload_bytes":1000,"segment_slices":[{"length_bytes":1000,"segment_id":0,"segment_offset_bytes":0}],"src_rank":0},{"dst_rank":3,"flow_group_id":1,"flow_id":1,"payload_bytes":4000,"segment_slices":[{"length_bytes":4000,"segment_id":1,"segment_offset_bytes":0}],"src_rank":2},{"dst_rank":2,"flow_group_id":2,"flow_id":2,"payload_bytes":1000,"segment_slices":[{"length_bytes":1000,"segment_id":2,"segment_offset_bytes":0}],"src_rank":0},{"dst_rank":3,"flow_group_id":3,"flow_id":3,"payload_bytes":1000,"segment_slices":[{"length_bytes":1000,"segment_id":3,"segment_offset_bytes":0}],"src_rank":2}],"logical_segments":[{"buffer_offset_bytes":0,"final_destination_rank_ids":[1],"length_bytes":1000,"origin_rank_ids":[0],"segment_id":0},{"buffer_offset_bytes":0,"final_destination_rank_ids":[3],"length_bytes":4000,"origin_rank_ids":[2],"segment_id":1},{"buffer_offset_bytes":0,"final_destination_rank_ids":[2],"length_bytes":1000,"origin_rank_ids":[0],"segment_id":2},{"buffer_offset_bytes":0,"final_destination_rank_ids":[3],"length_bytes":1000,"origin_rank_ids":[2],"segment_id":3}],"path_preparation_policy":"overlap_earliest","plane_programs":[{"epochs":[{"configuration_id":0,"flow_group_ids":[0],"path_prep_not_before_token_ids":[],"program_epoch_id":0,"transition":"initial"},{"configuration_id":1,"flow_group_ids":[2],"path_prep_not_before_token_ids":[],"program_epoch_id":1,"transition":"reconfigure"}],"plane_id":0},{"epochs":[{"configuration_id":0,"flow_group_ids":[1],"path_prep_not_before_token_ids":[],"program_epoch_id":0,"transition":"initial"},{"configuration_id":0,"flow_group_ids":[3],"path_prep_not_before_token_ids":[],"program_epoch_id":1,"transition":"retain"}],"plane_id":1}],"planner_certificate":{"bound_ps":null,"decision_sha256":null,"integer_lowering_rule":"hand_authored_exact_bytes","integer_lowering_version":"v1","nominal_schedule":[],"objective_ps":null,"planner_name":"hand_authored_fixture","planner_version":"v1","relative_gap_ppm":null,"solver_name":null,"solver_status":"not_used"},"provenance":{"collective_ir_sha256":null,"htsim_local_patchset_sha256":null,"htsim_upstream_git_sha":null,"instance_file_sha256":null,"overlap4ocs_git_sha":null,"plan_build_context_sha256":null,"program_file_sha256":null,"source_kind":"hand_authored_fixture"},"readiness_tokens":[{"producer_id":null,"token_id":0,"token_type":"collective_start"},{"producer_id":0,"token_id":1,"token_type":"flow_group_complete"},{"producer_id":1,"token_id":2,"token_type":"flow_group_complete"},{"producer_id":0,"token_id":3,"token_type":"step_complete"},{"producer_id":2,"token_id":4,"token_type":"flow_group_complete"},{"producer_id":3,"token_id":5,"token_type":"flow_group_complete"},{"producer_id":1,"token_id":6,"token_type":"step_complete"}],"run_limits":{"max_events":10000000,"max_sim_time_ps":1000000000000000,"seed":0},"schema_version":"swot-execution-plan/v2","steps":[{"completion_token_id":3,"flow_group_ids":[0,1],"phase":"phase0","step_id":0},{"completion_token_id":6,"flow_group_ids":[2,3],"phase":"phase1","step_id":1}],"strategy":"swot","topology":{"data_latency_ps":20,"duplex":"full","initial_configuration_policy":"first_use_preinstalled","node_count":4,"per_plane_bps":400000000000,"plane_count":2,"reconfiguration_delay_ps":200},"transport":{"ack_mode":"none","completion_semantics":"receiver_last_payload_byte","loss_mode":"lossless","mode":"paper_exact","mtu_bytes":1500,"packetization":"exact_tail","wire_model":"payload_only"},"units":{"data":"byte","rate":"bit_per_second","time":"picosecond"},"workload":{"algorithm_id":"k2-overlap_earliest-full_packet-remainder-0","algorithm_semantics_version":"fixture/v1","collective_id":"allreduce","collective_semantics_version":"allreduce/v1","message_bytes_per_rank":4000,"rank_count":4}}
