{"case_id":"case-675d24bf23d4b474ca33b728aa2bcdb0f95edbd57db6a11419eeee37db97d5f0","configurations":[{"configuration_id":0,"permutation":[1,0]}],"dependency_mode":"global_step_barrier","execution_mode":"full_packet","flow_groups":[{"completion_token_id":1,"configuration_id":0,"depends_on_token_ids":[0],"flow_group_id":0,"flow_ids":[0],"plane_id":0,"program_epoch_id":0,"step_id":0}],"flows":[{"dst_rank":1,"flow_group_id":0,"flow_id":0,"payload_bytes":1000,"segment_slices":[{"length_bytes":1000,"segment_id":0,"segment_offset_bytes":0}],"src_rank":0}],"logical_segments":[{"buffer_offset_bytes":0,"final_destination_rank_ids":[1],"length_bytes":1000,"origin_rank_ids":[0],"segment_id":0}],"path_preparation_policy":"overlap_earliest","plane_programs":[{"epochs":[{"configuration_id":0,"flow_group_ids":[0],"path_prep_not_before_token_ids":[],"program_epoch_id":0,"transition":"initial"}],"plane_id":0}],"planner_certificate":{"bound_ps":null,"decision_sha256":null,"integer_lowering_rule":"hand_authored_exact_bytes","integer_lowering_version":"v1","nominal_schedule":[],"objective_ps":null,"planner_name":"hand_authored_fixture","planner_version":"v1","relative_gap_ppm":null,"solver_name":null,"solver_status":"not_used"},"provenance":{"collective_ir_sha256":null,"htsim_local_patchset_sha256":null,"htsim_upstream_git_sha":null,"instance_file_sha256":null,"overlap4ocs_git_sha":null,"plan_build_context_sha256":null,"program_file_sha256":null,"source_kind":"hand_authored_fixture"},"readiness_tokens":[{"producer_id":null,"token_id":0,"token_type":"collective_start"},{"producer_id":0,"token_id":1,"token_type":"flow_group_complete"},{"producer_id":0,"token_id":2,"token_type":"step_complete"}],"run_limits":{"max_events":10000000,"max_sim_time_ps":1000000000000000,"seed":0},"schema_version":"swot-execution-plan/v2","steps":[{"completion_token_id":2,"flow_group_ids":[0],"phase":"fixture_phase_0","step_id":0}],"strategy":"swot","topology":{"data_latency_ps":20,"duplex":"full","initial_configuration_policy":"first_use_preinstalled","node_count":2,"per_plane_bps":400000000000,"plane_count":1,"reconfiguration_delay_ps":200},"transport":{"ack_mode":"none","completion_semantics":"receiver_last_payload_byte","loss_mode":"lossless","mode":"paper_exact","mtu_bytes":1500,"packetization":"exact_tail","wire_model":"payload_only"},"units":{"data":"byte","rate":"bit_per_second","time":"picosecond"},"workload":{"algorithm_id":"one_plane_one_group","algorithm_semantics_version":"fixture/v1","collective_id":"allreduce","collective_semantics_version":"allreduce/v1","message_bytes_per_rank":1000,"rank_count":2}}
