{"case_id":"case-d92265c0b3fd39c61f135106bdb1d76fdf2d580d7c98840e73d9240fc1877f3b","configurations":[{"configuration_id":0,"permutation":[1,2,0]}],"dependency_mode":"global_step_barrier","execution_mode":"full_packet","flow_groups":[{"completion_token_id":1,"configuration_id":0,"depends_on_token_ids":[0],"flow_group_id":0,"flow_ids":[0],"plane_id":0,"program_epoch_id":0,"step_id":0},{"completion_token_id":2,"configuration_id":0,"depends_on_token_ids":[0],"flow_group_id":1,"flow_ids":[1],"plane_id":1,"program_epoch_id":0,"step_id":0},{"completion_token_id":3,"configuration_id":0,"depends_on_token_ids":[0],"flow_group_id":2,"flow_ids":[2],"plane_id":2,"program_epoch_id":0,"step_id":0},{"completion_token_id":5,"configuration_id":0,"depends_on_token_ids":[4],"flow_group_id":3,"flow_ids":[3],"plane_id":1,"program_epoch_id":0,"step_id":1},{"completion_token_id":6,"configuration_id":0,"depends_on_token_ids":[4],"flow_group_id":4,"flow_ids":[4],"plane_id":2,"program_epoch_id":0,"step_id":1},{"completion_token_id":7,"configuration_id":0,"depends_on_token_ids":[4],"flow_group_id":5,"flow_ids":[5],"plane_id":0,"program_epoch_id":0,"step_id":1},{"completion_token_id":9,"configuration_id":0,"depends_on_token_ids":[8],"flow_group_id":6,"flow_ids":[6],"plane_id":2,"program_epoch_id":0,"step_id":2},{"completion_token_id":10,"configuration_id":0,"depends_on_token_ids":[8],"flow_group_id":7,"flow_ids":[7],"plane_id":0,"program_epoch_id":0,"step_id":2},{"completion_token_id":11,"configuration_id":0,"depends_on_token_ids":[8],"flow_group_id":8,"flow_ids":[8],"plane_id":1,"program_epoch_id":0,"step_id":2},{"completion_token_id":13,"configuration_id":0,"depends_on_token_ids":[12],"flow_group_id":9,"flow_ids":[9],"plane_id":0,"program_epoch_id":0,"step_id":3},{"completion_token_id":14,"configuration_id":0,"depends_on_token_ids":[12],"flow_group_id":10,"flow_ids":[10],"plane_id":1,"program_epoch_id":0,"step_id":3},{"completion_token_id":15,"configuration_id":0,"depends_on_token_ids":[12],"flow_group_id":11,"flow_ids":[11],"plane_id":2,"program_epoch_id":0,"step_id":3}],"flows":[{"dst_rank":1,"flow_group_id":0,"flow_id":0,"payload_bytes":1000,"segment_slices":[{"length_bytes":1000,"segment_id":0,"segment_offset_bytes":0}],"src_rank":0},{"dst_rank":2,"flow_group_id":1,"flow_id":1,"payload_bytes":1000,"segment_slices":[{"length_bytes":1000,"segment_id":1,"segment_offset_bytes":0}],"src_rank":1},{"dst_rank":0,"flow_group_id":2,"flow_id":2,"payload_bytes":1000,"segment_slices":[{"length_bytes":1000,"segment_id":2,"segment_offset_bytes":0}],"src_rank":2},{"dst_rank":1,"flow_group_id":3,"flow_id":3,"payload_bytes":1000,"segment_slices":[{"length_bytes":1000,"segment_id":3,"segment_offset_bytes":0}],"src_rank":0},{"dst_rank":2,"flow_group_id":4,"flow_id":4,"payload_bytes":1000,"segment_slices":[{"length_bytes":1000,"segment_id":4,"segment_offset_bytes":0}],"src_rank":1},{"dst_rank":0,"flow_group_id":5,"flow_id":5,"payload_bytes":1000,"segment_slices":[{"length_bytes":1000,"segment_id":5,"segment_offset_bytes":0}],"src_rank":2},{"dst_rank":1,"flow_group_id":6,"flow_id":6,"payload_bytes":1000,"segment_slices":[{"length_bytes":1000,"segment_id":6,"segment_offset_bytes":0}],"src_rank":0},{"dst_rank":2,"flow_group_id":7,"flow_id":7,"payload_bytes":1000,"segment_slices":[{"length_bytes":1000,"segment_id":7,"segment_offset_bytes":0}],"src_rank":1},{"dst_rank":0,"flow_group_id":8,"flow_id":8,"payload_bytes":1000,"segment_slices":[{"length_bytes":1000,"segment_id":8,"segment_offset_bytes":0}],"src_rank":2},{"dst_rank":1,"flow_group_id":9,"flow_id":9,"payload_bytes":1000,"segment_slices":[{"length_bytes":1000,"segment_id":9,"segment_offset_bytes":0}],"src_rank":0},{"dst_rank":2,"flow_group_id":10,"flow_id":10,"payload_bytes":1000,"segment_slices":[{"length_bytes":1000,"segment_id":10,"segment_offset_bytes":0}],"src_rank":1},{"dst_rank":0,"flow_group_id":11,"flow_id":11,"payload_bytes":1000,"segment_slices":[{"length_bytes":1000,"segment_id":11,"segment_offset_bytes":0}],"src_rank":2}],"logical_segments":[{"buffer_offset_bytes":0,"final_destination_rank_ids":[1],"length_bytes":1000,"origin_rank_ids":[0],"segment_id":0},{"buffer_offset_bytes":1000,"final_destination_rank_ids":[2],"length_bytes":1000,"origin_rank_ids":[1],"segment_id":1},{"buffer_offset_bytes":2000,"final_destination_rank_ids":[0],"length_bytes":1000,"origin_rank_ids":[2],"segment_id":2},{"buffer_offset_bytes":2000,"final_destination_rank_ids":[1],"length_bytes":1000,"origin_rank_ids":[0],"segment_id":3},{"buffer_offset_bytes":0,"final_destination_rank_ids":[2],"length_bytes":1000,"origin_rank_ids":[1],"segment_id":4},{"buffer_offset_bytes":1000,"final_destination_rank_ids":[0],"length_bytes":1000,"origin_rank_ids":[2],"segment_id":5},{"buffer_offset_bytes":0,"final_destination_rank_ids":[1],"length_bytes":1000,"origin_rank_ids":[0],"segment_id":6},{"buffer_offset_bytes":1000,"final_destination_rank_ids":[2],"length_bytes":1000,"origin_rank_ids":[1],"segment_id":7},{"buffer_offset_bytes":2000,"final_destination_rank_ids":[0],"length_bytes":1000,"origin_rank_ids":[2],"segment_id":8},{"buffer_offset_bytes":2000,"final_destination_rank_ids":[1],"length_bytes":1000,"origin_rank_ids":[0],"segment_id":9},{"buffer_offset_bytes":0,"final_destination_rank_ids":[2],"length_bytes":1000,"origin_rank_ids":[1],"segment_id":10},{"buffer_offset_bytes":1000,"final_destination_rank_ids":[0],"length_bytes":1000,"origin_rank_ids":[2],"segment_id":11}],"path_preparation_policy":"static_preinstalled","plane_programs":[{"epochs":[{"configuration_id":0,"flow_group_ids":[0,5,7,9],"path_prep_not_before_token_ids":[],"program_epoch_id":0,"transition":"initial"}],"plane_id":0},{"epochs":[{"configuration_id":0,"flow_group_ids":[1,3,8,10],"path_prep_not_before_token_ids":[],"program_epoch_id":0,"transition":"initial"}],"plane_id":1},{"epochs":[{"configuration_id":0,"flow_group_ids":[2,4,6,11],"path_prep_not_before_token_ids":[],"program_epoch_id":0,"transition":"initial"}],"plane_id":2}],"planner_certificate":{"bound_ps":null,"decision_sha256":null,"integer_lowering_rule":"hand_authored_exact_bytes","integer_lowering_version":"v1","nominal_schedule":[],"objective_ps":null,"planner_name":"hand_authored_fixture","planner_version":"v1","relative_gap_ppm":null,"solver_name":null,"solver_status":"not_used"},"provenance":{"collective_ir_sha256":null,"htsim_local_patchset_sha256":null,"htsim_upstream_git_sha":null,"instance_file_sha256":null,"overlap4ocs_git_sha":null,"plan_build_context_sha256":null,"program_file_sha256":null,"source_kind":"hand_authored_fixture"},"readiness_tokens":[{"producer_id":null,"token_id":0,"token_type":"collective_start"},{"producer_id":0,"token_id":1,"token_type":"flow_group_complete"},{"producer_id":1,"token_id":2,"token_type":"flow_group_complete"},{"producer_id":2,"token_id":3,"token_type":"flow_group_complete"},{"producer_id":0,"token_id":4,"token_type":"step_complete"},{"producer_id":3,"token_id":5,"token_type":"flow_group_complete"},{"producer_id":4,"token_id":6,"token_type":"flow_group_complete"},{"producer_id":5,"token_id":7,"token_type":"flow_group_complete"},{"producer_id":1,"token_id":8,"token_type":"step_complete"},{"producer_id":6,"token_id":9,"token_type":"flow_group_complete"},{"producer_id":7,"token_id":10,"token_type":"flow_group_complete"},{"producer_id":8,"token_id":11,"token_type":"flow_group_complete"},{"producer_id":2,"token_id":12,"token_type":"step_complete"},{"producer_id":9,"token_id":13,"token_type":"flow_group_complete"},{"producer_id":10,"token_id":14,"token_type":"flow_group_complete"},{"producer_id":11,"token_id":15,"token_type":"flow_group_complete"},{"producer_id":3,"token_id":16,"token_type":"step_complete"}],"run_limits":{"max_events":10000000,"max_sim_time_ps":1000000000000000,"seed":0},"schema_version":"swot-execution-plan/v2","steps":[{"completion_token_id":4,"flow_group_ids":[0,1,2],"phase":"reduce_scatter_0","step_id":0},{"completion_token_id":8,"flow_group_ids":[3,4,5],"phase":"reduce_scatter_1","step_id":1},{"completion_token_id":12,"flow_group_ids":[6,7,8],"phase":"allgather_0","step_id":2},{"completion_token_id":16,"flow_group_ids":[9,10,11],"phase":"allgather_1","step_id":3}],"strategy":"one_shot","topology":{"data_latency_ps":20,"duplex":"full","initial_configuration_policy":"first_use_preinstalled","node_count":3,"per_plane_bps":400000000000,"plane_count":3,"reconfiguration_delay_ps":200},"transport":{"ack_mode":"none","completion_semantics":"receiver_last_payload_byte","loss_mode":"lossless","mode":"paper_exact","mtu_bytes":1500,"packetization":"exact_tail","wire_model":"payload_only"},"units":{"data":"byte","rate":"bit_per_second","time":"picosecond"},"workload":{"algorithm_id":"ring_allreduce","algorithm_semantics_version":"ring/v1","collective_id":"allreduce","collective_semantics_version":"allreduce/v1","message_bytes_per_rank":3000,"rank_count":3}}
